"Explicit",12,18,13,10,"50th percentile",NA,NA,NA,NA,NA,NA,NA,NA,NA,NA,NA,NA,NA,NA,NA,NA,3,4,3,3,3,5,4,3,2,3,3,4,4,2,1,3,4,2,5,5,5,5,5,5,1,1,1,4,3,2,2,3,1,4,2,1,1,1,4,3,3,4,3,3,2,1,3,4,3,3,531,"None","To test how people perceive themselves and their abilities versus an actual representation of their abilities","65cfe5f97c0ea4d16a306e77",NA,NA,3.5,3.167,2.667,5,5,2.5,3.333,2,3.333
"Explicit",8,22,8,10,"75th percentile",NA,NA,NA,NA,NA,NA,NA,NA,NA,NA,NA,NA,NA,NA,NA,NA,4,4,2,3,4,5,4,3,2,3,3,3,3,3,2,3,3,2,4,4,4,4,4,4,1,2,2,4,1,1,4,3,1,1,5,1,1,1,2,1,1,3,4,3,4,4,3,3,3,3,657,NA,"See our perceptions of our race and test how well we do in spatial recognition and how they correlate","5c91b7eabc1a950001fbfdca",NA,NA,3.667,3,2.667,4,4,2.333,2.333,3.667,3
"Implicit",14,18,15,13,"50th percentile",NA,NA,NA,NA,NA,NA,NA,NA,NA,NA,"Chinese","Chinese, Spanish","Chinese",NA,1,1,NA,NA,NA,NA,NA,NA,NA,NA,NA,NA,NA,NA,4,2,2,4,3,3,4,4,4,4,4,4,1,2,2,2,4,4,2,2,4,3,2,3,3,3,2,2,2,3,5,5,3,3,2,3,3,3,465,NA,"Observing feeling of pressure when completing a task","5e65a37956f27a3290acfcbe",NA,NA,NA,NA,3,4,4,3,3.167,2.667,3
"Control",6,27,8,8,"50th percentile",4,4,3,3,4,2,3,2,5,3,NA,NA,NA,NA,NA,NA,NA,NA,NA,NA,NA,NA,NA,NA,NA,NA,NA,NA,3,1,1,4,2,1,3,1,3,1,3,3,2,1,1,3,2,1,3,3,2,3,2,2,2,2,2,1,1,3,3,1,3,2,4,3,1,1,626,"response time between shapes should be lengthened it was extremely short.","n/a","62ce01e10103af1a049c6b31",3.6,3,NA,NA,2,1.667,3,2.333,1.833,3,1.667
"Control",8,25,2,3,"25th percentile",3,3,2,2,4,3,3,2,3,2,NA,NA,NA,NA,NA,NA,NA,NA,NA,NA,NA,NA,NA,NA,NA,NA,NA,NA,3,2,3,3,2,2,4,4,2,4,2,2,1,1,1,2,3,2,2,2,4,3,4,2,2,2,4,3,3,4,3,2,3,4,4,3,4,3,1074,"It made me feel bad about my math skills","To understand how being told we did poorly affects our mood or self esteem","607dc095678516f84e3fdae6",2.8,2.6,NA,NA,2.5,4,2,2.5,3.167,3.667,3.333
"Implicit",14,30,13,11,"75th percentile",NA,NA,NA,NA,NA,NA,NA,NA,NA,NA,"Cantonese","None",NA,NA,1,2,NA,NA,NA,NA,NA,NA,NA,NA,NA,NA,NA,NA,3,1,1,3,4,1,4,4,5,3,5,5,1,1,1,2,4,1,2,3,3,4,3,4,3,2,4,1,1,3,2,3,4,5,3,3,3,4,642,NA,"self-worth based on school tasks","5ebb08645a22c70c2ba793e4",NA,NA,NA,NA,2.167,3.667,5,2.5,2.333,4,3.333
"Explicit",13,20,0,5,"50th percentile",NA,NA,NA,NA,NA,NA,NA,NA,NA,NA,NA,NA,NA,NA,NA,NA,4,4,5,1,3,5,3,3,1,1,3,3,4,1,2,3,3,2,5,5,5,3,4,4,1,1,1,2,3,1,2,1,2,2,5,2,1,1,3,2,4,2,1,2,1,1,1,3,4,5,615,"N/A","Not sure","611365850f7842366cbfaa68",NA,NA,3.667,2.333,2.5,4.333,4.333,1.833,2.333,1,4
"Implicit",9,18,3,1,"10th percentile",NA,NA,NA,NA,NA,NA,NA,NA,NA,NA,"mandarin, taiwanese","mandarin","mandarin",NA,1,1,NA,NA,NA,NA,NA,NA,NA,NA,NA,NA,NA,NA,4,1,2,3,4,1,4,4,4,3,4,4,1,2,1,2,4,3,1,2,1,5,1,1,1,1,4,2,2,2,4,2,4,2,3,3,3,3,650,"the time limit was pretty stressful and I didn't have enough time to do the task accurately. i was kind of guessing on some of the questions","how people view themselves and how their emotions change after a task","6598942c3d07928cc188ffdb",NA,NA,NA,NA,2.5,3.667,4,2.167,2.667,3,3
"Control",9,23,7,6,"50th percentile",4,4,3,4,3,3,3,2,4,3,NA,NA,NA,NA,NA,NA,NA,NA,NA,NA,NA,NA,NA,NA,NA,NA,NA,NA,3,2,1,3,3,1,3,3,4,3,4,4,1,2,1,2,4,3,1,1,2,4,4,3,2,2,2,1,2,3,4,2,3,4,4,3,4,3,897,"I believe the purpose of the spatial rotation task is to induce a specific emotional state in the participant so this may be irrelevant however the ability to answer separately after seeing the image may be beneficial as there were a few instances where I knew the answer however was not able to click it before time ran out. If we are meant to have eight seconds, putting the answer time within that range does not feel like a true eight seconds. Otherwise, the rotation task was very fun. Thank you!","The impact of stress on social perception and belongingness","65cbab070b9dca9291cd7848",3.6,3,NA,NA,2.167,3,4,2.167,2.333,3.667,3.333
"Explicit",5,21,10,7,"50th percentile",NA,NA,NA,NA,NA,NA,NA,NA,NA,NA,NA,NA,NA,NA,NA,NA,2,3,4,4,2,5,3,2,2,2,2,3,3,1,1,4,4,1,5,4,4,4,4,4,1,2,1,3,1,1,3,3,1,2,4,3,3,2,4,2,2,4,4,4,4,4,3,2,2,2,554,"na","determine correlation of math and spatial rotation test as a predictor to math scores.","65a58b087781836186ca5b78",NA,NA,3.333,2.333,2.333,4.333,4,2,3.333,3.667,2
"Control",7,19,4,3,"10th percentile",2,4,4,3,3,4,4,3,4,3,NA,NA,NA,NA,NA,NA,NA,NA,NA,NA,NA,NA,NA,NA,NA,NA,NA,NA,2,4,3,2,2,4,4,4,4,3,5,5,1,1,1,1,2,3,1,1,3,3,5,1,1,1,3,2,3,3,3,4,2,1,1,2,1,3,779,"I don't really see how this measures math ability","See if a test advertised as seeing ""math ability"" makes us feel stressed","63f77ab51428a164ec2edbab",3.2,3.6,NA,NA,2.833,3.667,4.667,1.833,3,1.333,2
"Control",12,19,11,9,"75th percentile",4,2,2,3,3,3,2,2,3,3,NA,NA,NA,NA,NA,NA,NA,NA,NA,NA,NA,NA,NA,NA,NA,NA,NA,NA,4,1,1,4,4,1,4,4,4,4,4,4,1,1,1,3,2,1,3,3,1,3,5,2,1,1,3,3,2,3,4,3,5,3,1,2,2,2,475,NA,"To gauge how performing a spacial rotation task affects people's current state as well as their perceptions of their academic performance","65bff5ce2c3df3a5127fa462",2.8,2.6,NA,NA,2.5,4,4,2.167,3,3,2
"Explicit",10,26,4,6,"50th percentile",NA,NA,NA,NA,NA,NA,NA,NA,NA,NA,NA,NA,NA,NA,NA,NA,4,5,4,3,4,5,3,2,1,2,2,2,3,3,1,2,2,2,3,2,3,2,3,3,1,2,1,1,2,2,1,1,1,2,5,3,1,2,3,3,2,3,3,2,2,2,3,4,5,5,875,"I have my master's degree but changed majors, so I am pursuing an associate's at community college.","See if there is an association between (perceived) performance on math-related items and self-image as it relates to race.","5f2908bb9c5b402bc5b1a9b7",NA,NA,4.167,2,2.167,2.333,3,1.333,2.667,2.333,4.667
"Explicit",14,19,15,13,"75th percentile",NA,NA,NA,NA,NA,NA,NA,NA,NA,NA,NA,NA,NA,NA,NA,NA,4,4,5,2,3,5,3,2,2,2,4,2,4,1,1,3,3,2,4,4,4,4,4,4,1,1,2,3,2,2,3,3,2,2,4,3,1,2,5,3,4,4,5,2,2,4,4,3,4,3,703,"It was good","Study math ability to race","65296a5e6b3da09843f655ba",NA,NA,3.833,2.5,2.333,4,4,2.5,3.833,3.333,3.333
"Explicit",14,20,12,10,"50th percentile",NA,NA,NA,NA,NA,NA,NA,NA,NA,NA,NA,NA,NA,NA,NA,NA,3,4,4,3,4,5,4,3,4,3,4,4,3,2,3,4,5,1,4,3,3,3,2,2,1,2,2,3,3,2,4,5,2,3,3,3,2,1,4,3,4,2,5,4,4,4,4,4,5,5,709,"Interesting survey!","I think the purpose of this study was to identify how different people perceive themself and the decisions that they make in a daily basis.","63e51e55974365f1e43df265",NA,NA,3.833,3.667,3,3.333,2.333,3.167,3.667,4,4.667
"Control",8,23,0,4,"25th percentile",3,4,5,3,4,2,3,4,3,4,NA,NA,NA,NA,NA,NA,NA,NA,NA,NA,NA,NA,NA,NA,NA,NA,NA,NA,2,3,3,3,2,4,3,2,4,3,4,3,1,1,1,2,3,2,1,1,2,2,3,2,1,2,5,4,2,3,5,5,3,3,4,2,2,2,1808,"N/A","Racial self perception and confidence in mathmatics correlation","65755801000442e5a54f5005",3.8,3.2,NA,NA,2.833,2.667,3.667,1.833,4,3.333,2
"Implicit",15,21,15,15,"90th percentile",NA,NA,NA,NA,NA,NA,NA,NA,NA,NA,"tagalog","japanese",NA,NA,2,1,NA,NA,NA,NA,NA,NA,NA,NA,NA,NA,NA,NA,3,2,2,3,3,2,3,4,2,1,1,1,1,1,1,3,2,2,3,3,2,1,5,3,2,1,1,1,1,3,3,3,1,1,5,4,3,3,376,NA,"how we perceive ourselves based on a task","5f6c102b6ec04317fc9a8127",NA,NA,NA,NA,2.5,2.667,1.333,2.5,2,2.333,3.333
"Control",12,22,12,10,"50th percentile",2,2,2,2,2,2,2,1,2,2,NA,NA,NA,NA,NA,NA,NA,NA,NA,NA,NA,NA,NA,NA,NA,NA,NA,NA,3,1,1,3,3,1,3,1,2,1,2,2,1,2,1,3,1,1,3,3,1,2,5,2,1,1,1,1,1,3,3,1,4,4,4,3,3,3,366,NA,NA,"65cfe9b23cb896bff6ca420b",2,1.8,NA,NA,2,1.667,2,2,1.667,4,3
"Implicit",14,22,10,8,"50th percentile",NA,NA,NA,NA,NA,NA,NA,NA,NA,NA,"Chinese","Chinese","Chinese","10",1,1,NA,NA,NA,NA,NA,NA,NA,NA,NA,NA,NA,NA,4,3,1,3,2,2,2,2,3,4,3,3,1,1,1,3,2,2,2,1,2,3,4,3,2,2,2,3,2,3,4,3,3,4,2,3,3,3,618,"It went smoothly!","3D objects and how one perceives reality","63bd8c28fb1d955babddd6d5",NA,NA,NA,NA,2.5,2.667,3,2,2.833,3,3
"Explicit",10,32,5,5,"25th percentile",NA,NA,NA,NA,NA,NA,NA,NA,NA,NA,NA,NA,NA,NA,NA,NA,3,4,3,4,4,5,3,4,3,3,4,4,5,1,1,5,5,1,3,4,4,3,1,3,1,1,1,3,2,1,3,3,1,3,3,2,2,2,2,3,3,2,4,4,3,3,3,2,2,2,462,"No","To see my abilities as an Asian male and how racism and stereotypes played.","5f58597e2f53113c7bd47ab3",NA,NA,3.833,3.5,3,3.333,2.667,2.167,3,3,2
"Explicit",13,24,7,5,"10th percentile",NA,NA,NA,NA,NA,NA,NA,NA,NA,NA,NA,NA,NA,NA,NA,NA,4,4,2,5,3,4,4,5,3,5,4,4,3,2,2,3,1,3,3,3,5,3,5,5,1,2,2,1,5,5,1,1,5,5,5,1,1,1,5,5,5,1,5,5,5,5,5,1,1,1,664,NA,"how students perceive grading before and after receiving grades from exams and how their performances affect self esteem","5d61a3001c84fc001780f4ad",NA,NA,3.667,4.167,2.333,3,5,3,4.333,5,1
"Implicit",12,22,10,8,"50th percentile",NA,NA,NA,NA,NA,NA,NA,NA,NA,NA,"Chinese",NA,NA,NA,1,1,NA,NA,NA,NA,NA,NA,NA,NA,NA,NA,NA,NA,2,4,2,1,2,4,4,4,4,2,4,3,1,2,1,1,5,4,1,1,4,3,2,2,1,1,5,3,4,4,4,4,5,5,1,5,5,5,500,NA,"To test how well people understand spatial rotation and see how their current emotions reflect their way of thinking.","65ccf5c22a3ceca2b3cf14e9",NA,NA,NA,NA,2.5,3.333,3.667,2.667,4,3.667,5
"Control",5,21,10,12,"75th percentile",3,3,3,4,4,2,2,3,5,3,NA,NA,NA,NA,NA,NA,NA,NA,NA,NA,NA,NA,NA,NA,NA,NA,NA,NA,4,1,1,4,4,2,3,3,4,3,4,3,1,2,2,3,2,2,3,3,2,3,5,2,2,2,2,2,2,3,4,3,1,1,2,2,3,2,566,"It was harder than I thought it would be; Definitely scored lower than I thought too","To measure ability of those from different backgrounds to recognize shapes and when they are rotated and transformed","65d51baa9930b7a969cca0f7",3.4,3,NA,NA,2.667,3,3.667,2.5,2.667,1.333,2.333
"Control",12,34,6,4,"25th percentile",5,3,3,3,4,3,2,1,3,3,NA,NA,NA,NA,NA,NA,NA,NA,NA,NA,NA,NA,NA,NA,NA,NA,NA,NA,5,2,1,4,4,1,5,5,3,4,2,2,1,1,1,4,2,1,5,4,1,3,5,3,1,2,3,3,3,4,4,2,2,3,2,3,2,2,438,NA,"i dont know","65cafdc775f31ba7a74c26c3",3.6,2.4,NA,NA,2.833,4.667,2.333,2.833,3.167,2.333,2.333
"Explicit",6,20,10,5,"25th percentile",NA,NA,NA,NA,NA,NA,NA,NA,NA,NA,NA,NA,NA,NA,NA,NA,5,5,1,1,3,3,5,5,1,2,2,2,3,3,3,2,1,2,4,4,5,3,5,5,1,2,2,2,3,3,2,1,2,3,4,2,2,1,5,4,4,2,2,2,1,1,5,5,5,5,464,"N/A","Seeing if how well you score of spacial rotation is any indication of how well you do at math","655f8b6aead3b1448f52681b",NA,NA,3,2.833,2.333,3.667,5,2.167,3.167,2.333,5
"Explicit",9,22,6,3,"25th percentile",NA,NA,NA,NA,NA,NA,NA,NA,NA,NA,NA,NA,NA,NA,NA,NA,4,4,2,4,4,5,5,4,2,4,4,4,4,2,1,3,3,1,5,5,5,5,4,4,1,1,1,2,3,2,2,2,2,3,5,3,3,3,4,2,2,3,2,2,2,2,4,4,3,3,560,"this was challenging and i wish there was a more obvious countdown to know how much time we have left to answer the question","to find the link between spatial rotation and math ability","65cc503b2b3565cba17be791",NA,NA,3.833,3.833,2.333,5,4.333,2.167,2.5,2.667,3.333
"Implicit",7,19,8,8,"50th percentile",NA,NA,NA,NA,NA,NA,NA,NA,NA,NA,NA,"Korean",NA,NA,1,2,NA,NA,NA,NA,NA,NA,NA,NA,NA,NA,NA,NA,4,2,1,4,4,2,5,5,5,5,4,4,1,1,1,3,3,1,4,4,1,2,4,3,2,2,3,5,4,2,3,3,5,1,3,4,4,4,695,"The survey was good and ran smoothly.","To measure mathematical skills","65d5207c5a28986aba880a4c",NA,NA,NA,NA,2.833,5,4.333,2.667,3.333,3,4
"Implicit",10,22,7,7,"50th percentile",NA,NA,NA,NA,NA,NA,NA,NA,NA,NA,"Nepai","Nepali, Hindi, Urdu, Spanish","Nepali",NA,2,1,NA,NA,NA,NA,NA,NA,NA,NA,NA,NA,NA,NA,3,2,1,2,4,2,4,4,4,4,4,4,1,2,2,2,4,2,2,3,2,3,5,2,2,2,3,4,3,3,2,2,4,3,4,5,5,5,477,"Very interesting survey. I did not think I would get a high score like that I'm very impressed with myself.","To test spatial rotation of an individual and maybe convert to the math skills one has.","65cd317ff963d201475b79d1",NA,NA,NA,NA,2.333,4,4,2.5,2.833,3.667,5
"Implicit",10,22,5,3,"10th percentile",NA,NA,NA,NA,NA,NA,NA,NA,NA,NA,"Vietnamese","Vietnamese","Vietnamese",NA,1,1,NA,NA,NA,NA,NA,NA,NA,NA,NA,NA,NA,NA,2,3,3,2,2,4,3,4,4,3,4,4,1,1,1,1,4,3,1,1,4,4,3,3,3,3,4,1,1,1,1,1,4,4,4,2,2,2,518,"I scored significantly higher than I thought I would.","I think it is to study the association between spatial reasoning and how we perceive ourselves compared to our peers.","65cb6c93a2b5419209db3f1f",NA,NA,NA,NA,2.667,3.333,4,2.333,1.5,4,2
"Explicit",7,26,6,5,"50th percentile",NA,NA,NA,NA,NA,NA,NA,NA,NA,NA,NA,NA,NA,NA,NA,NA,5,5,3,1,5,5,4,3,1,1,5,3,4,1,1,4,4,1,3,3,4,2,3,3,1,2,2,3,1,1,3,2,1,2,1,1,1,1,2,2,2,4,1,2,1,1,5,3,2,2,644,"None","Correlation of race and math ability.","65aee576ac09f8926668a1fd",NA,NA,4,2.833,2.5,2.667,3.333,1.833,2.167,2.333,2.333
"Explicit",6,37,5,3,"50th percentile",NA,NA,NA,NA,NA,NA,NA,NA,NA,NA,NA,NA,NA,NA,NA,NA,3,3,3,3,3,4,4,3,3,3,4,3,4,2,2,3,4,4,4,3,4,4,4,3,1,1,1,4,2,3,4,4,3,3,4,3,3,2,4,3,4,3,4,3,4,3,3,4,3,2,285,"it was difficult","spacial imaging","627120b98967a5dbd4922c2e",NA,NA,3.167,3.333,3.167,3.667,3.667,3.333,3.5,3.333,3
"Control",9,24,8,5,"50th percentile",4,4,3,5,4,5,5,2,5,5,NA,NA,NA,NA,NA,NA,NA,NA,NA,NA,NA,NA,NA,NA,NA,NA,NA,NA,2,4,4,2,2,5,5,4,5,5,5,5,1,1,2,2,4,4,2,2,5,3,3,2,2,2,5,5,5,3,5,5,3,3,2,2,2,1,485,"No","Measure particpant's feelings before and after thinking task","6431fa7dd113eda38603cabc",4,4.4,NA,NA,3.167,4.667,5,3.167,4.667,2.667,1.667
"Explicit",7,23,5,3,"50th percentile",NA,NA,NA,NA,NA,NA,NA,NA,NA,NA,NA,NA,NA,NA,NA,NA,3,4,3,4,4,4,4,4,2,2,4,3,4,2,2,4,4,2,4,4,4,4,4,4,1,2,2,3,3,3,3,3,2,4,2,3,3,2,3,3,2,4,4,4,3,3,3,2,2,2,679,"Very interesting survey.","How people behave under different situations?","60d1129ad29dbe85a59b9c4a",NA,NA,3.667,3.167,3,4,4,2.833,3.333,3,2
"Implicit",3,33,10,10,"50th percentile",NA,NA,NA,NA,NA,NA,NA,NA,NA,NA,NA,"None",NA,NA,2,2,NA,NA,NA,NA,NA,NA,NA,NA,NA,NA,NA,NA,4,1,1,5,4,1,5,5,5,5,4,5,1,1,1,5,1,1,3,3,1,1,5,2,2,2,5,1,1,5,1,1,1,1,1,1,1,1,895,"I am really sad that I did that bad","To see how I performed with these models","6073ad2cd288215f64f51efa",NA,NA,NA,NA,2.667,5,4.667,2.333,2.333,1,1
"Control",7,23,8,7,"25th percentile",3,2,2,4,3,3,3,2,3,3,NA,NA,NA,NA,NA,NA,NA,NA,NA,NA,NA,NA,NA,NA,NA,NA,NA,NA,2,2,1,2,2,3,4,4,5,5,5,5,1,2,1,1,2,2,1,1,2,3,2,2,1,2,5,5,4,3,5,5,1,1,2,5,5,5,806,"it was good overall!","to find the relationship between academic mindsets/race identity and overall math abilities","65d7e892ede5cc787cc474cb",2.8,2.8,NA,NA,2,4.333,5,1.5,4.5,1.333,5
"Control",13,25,7,7,"50th percentile",2,4,3,2,4,2,3,3,2,3,NA,NA,NA,NA,NA,NA,NA,NA,NA,NA,NA,NA,NA,NA,NA,NA,NA,NA,3,2,2,2,1,3,4,1,1,1,1,1,1,2,1,3,3,2,2,1,3,1,3,3,2,2,4,1,1,3,1,1,3,2,3,4,4,4,449,"n/a","pressure of comparison to peers?","5d1b8ca0d057270001a0abca",3,2.6,NA,NA,2.167,2,1,2.333,1.833,2.667,4
"Explicit",12,18,4,6,"50th percentile",NA,NA,NA,NA,NA,NA,NA,NA,NA,NA,NA,NA,NA,NA,NA,NA,4,3,4,4,4,5,3,1,2,3,2,3,4,1,1,4,4,2,5,5,4,5,4,4,1,2,2,4,1,1,4,3,2,3,3,3,3,2,4,4,4,4,5,3,2,2,5,4,4,4,632,NA,"Evaluating perception/stereotypes of Asian Americans and comparing it with actual statistical results","65d586699088ec8e476ad029",NA,NA,4,2.333,2.667,5,4,2.5,4,3,4
"Control",13,26,10,6,"25th percentile",4,4,4,4,4,3,3,4,4,4,NA,NA,NA,NA,NA,NA,NA,NA,NA,NA,NA,NA,NA,NA,NA,NA,NA,NA,2,4,1,2,3,4,4,4,4,4,4,4,1,2,1,2,4,3,2,2,3,4,4,3,1,1,4,4,4,4,3,3,4,4,2,4,4,4,517,NA,"understanding how feedback on performance impacts perception of performance","65d509e9ef40f8b8cbf93834",4,3.6,NA,NA,2.667,4,4,2.667,3.667,3.333,4
"Explicit",10,18,7,4,"25th percentile",NA,NA,NA,NA,NA,NA,NA,NA,NA,NA,NA,NA,NA,NA,NA,NA,3,3,2,2,3,4,3,1,1,2,2,2,4,1,1,3,3,2,3,3,3,3,4,4,1,1,1,4,1,1,3,3,2,2,3,2,1,1,4,2,2,2,4,4,4,3,4,2,3,3,407,NA,"To measure Asian-American responses to a diagnostic math test","65185750126ba439e0d8ca1e",NA,NA,2.833,1.833,2.333,3,3.667,2.333,3,3.667,2.667
"Implicit",11,22,10,5,"50th percentile",NA,NA,NA,NA,NA,NA,NA,NA,NA,NA,"Vietnamese","Vietnamese",NA,NA,2,1,NA,NA,NA,NA,NA,NA,NA,NA,NA,NA,NA,NA,4,1,1,4,3,1,4,4,2,2,5,4,1,2,1,3,2,2,3,2,2,2,3,3,3,3,2,1,1,4,4,2,2,2,3,3,2,2,924,"I was a little surprised at the part when I had to choose whether the objects matches or not. I didn't think it would go to the next question after 8 seconds so I misclicked one of the answers.","To see if there is a relationship between one's spatial cognition ability and one's math ability.","65cbdbc2d854fbc1b6c701e6",NA,NA,NA,NA,2.333,3.333,3.667,2.333,2.333,2.333,2.333
"Control",11,37,5,5,"25th percentile",4,4,4,4,4,4,4,4,4,4,NA,NA,NA,NA,NA,NA,NA,NA,NA,NA,NA,NA,NA,NA,NA,NA,NA,NA,2,2,2,1,1,2,4,4,4,4,4,4,1,1,1,2,2,2,1,1,2,3,4,3,2,2,4,4,4,2,4,4,4,4,2,3,3,3,490,NA,"to see where i stand on the results of the spatial rotation task","5ca1c71d44a54a00166d1dd7",4,4,NA,NA,1.667,4,4,1.667,3.667,3.333,3
"Implicit",10,19,12,10,"50th percentile",NA,NA,NA,NA,NA,NA,NA,NA,NA,NA,"Telugu, Viet","Spanish",NA,NA,1,1,NA,NA,NA,NA,NA,NA,NA,NA,NA,NA,NA,NA,4,2,1,4,3,3,3,4,3,4,2,3,1,2,1,3,2,1,3,3,2,2,3,2,1,1,3,2,1,4,3,4,4,3,3,2,2,1,492,NA,"To see how our performance on the spatial rotation task affected our mood/emotion","60147514665c424b4b812e7d",NA,NA,NA,NA,2.833,3.667,2.667,2.333,2.833,3.333,1.667
"Explicit",10,24,4,5,"25th percentile",NA,NA,NA,NA,NA,NA,NA,NA,NA,NA,NA,NA,NA,NA,NA,NA,5,5,5,5,5,5,5,4,2,3,3,2,5,1,1,5,5,2,4,4,4,4,4,4,1,1,1,2,3,4,2,1,3,4,3,1,1,1,4,5,3,1,3,3,5,5,4,3,3,3,429,"I found the activity interesting but hard, but I want to know if it really correlates to math ability?","How we feel about accomplishing tasks and our race. Do we feel pressure to perform well due to our race and its stereotypes?","6595784e1782997a5c7d6a1b",NA,NA,5,3.167,3.167,4,4,2.5,3.167,4.667,3
"Explicit",6,22,12,5,"25th percentile",NA,NA,NA,NA,NA,NA,NA,NA,NA,NA,NA,NA,NA,NA,NA,NA,4,4,3,3,3,4,2,2,2,1,3,3,4,2,1,3,3,2,4,3,4,4,3,4,1,1,1,2,4,3,2,1,3,4,2,3,1,1,3,1,1,4,2,2,2,1,3,3,4,2,359,NA,"To measure self-depictions of race before and after doing a stressful task?","6000ca0be380e61f33f7a0fa",NA,NA,3.5,2.167,2.5,3.667,3.667,2.5,2.167,2,3
"Implicit",10,27,7,5,"25th percentile",NA,NA,NA,NA,NA,NA,NA,NA,NA,NA,"Vietnamese","Vietnamese (not fluent)","Vietnamese",NA,2,1,NA,NA,NA,NA,NA,NA,NA,NA,NA,NA,NA,NA,3,3,2,2,2,4,2,4,4,4,5,4,1,1,1,1,4,4,1,1,3,4,5,2,3,3,3,2,2,3,5,4,3,1,4,4,5,5,561,NA,"Finding out the relationship between feeling successful at school and performance on spatial rotation test","5c4bfc488897520001567367",NA,NA,NA,NA,2.667,3.333,4.333,2.333,3.167,2.667,4.667
"Control",10,23,8,8,"50th percentile",4,4,3,4,4,4,3,3,5,3,NA,NA,NA,NA,NA,NA,NA,NA,NA,NA,NA,NA,NA,NA,NA,NA,NA,NA,4,1,1,4,4,1,3,3,4,2,4,4,1,1,1,4,1,1,4,4,1,2,3,2,1,1,4,2,2,2,2,2,1,1,5,5,5,5,316,NA,"To see a relationship between feelings of isolation and spatial reasoning","5b5955e7f2333f00013176b2",3.8,3.6,NA,NA,2.5,2.667,4,2.5,2.333,2.333,5
"Explicit",7,21,7,5,"50th percentile",NA,NA,NA,NA,NA,NA,NA,NA,NA,NA,NA,NA,NA,NA,NA,NA,4,3,2,2,3,3,4,3,3,2,3,4,4,1,1,3,3,1,4,3,3,4,2,2,1,1,1,2,2,1,2,2,2,3,3,2,2,2,3,2,2,3,2,2,5,3,2,3,3,2,386,NA,"To test abilities of asian american students","6110cb9fd3ba23cecacc8fc4",NA,NA,2.833,3.167,2.167,3.667,2.333,1.833,2.333,3.333,2.667
"Control",7,18,5,5,"50th percentile",2,5,3,2,4,1,3,2,3,2,NA,NA,NA,NA,NA,NA,NA,NA,NA,NA,NA,NA,NA,NA,NA,NA,NA,NA,4,1,1,4,3,1,5,5,3,4,4,4,1,1,2,4,2,1,3,3,1,4,4,1,1,1,4,1,1,4,1,1,3,2,2,3,3,4,450,NA,"how self perception about race affects how we did on the spatial rotation task","65cb5e15f8685a04fa82ff0f",3.2,2.2,NA,NA,2.333,4.667,3.667,2.333,2,2.333,3.333
"Implicit",6,23,9,7,"50th percentile",NA,NA,NA,NA,NA,NA,NA,NA,NA,NA,"Japanese","Spanish",NA,NA,2,1,NA,NA,NA,NA,NA,NA,NA,NA,NA,NA,NA,NA,4,1,1,3,5,2,3,5,4,5,4,5,1,1,2,2,3,2,3,2,2,3,2,2,1,1,3,1,2,5,3,2,1,1,3,2,3,4,445,"It is a bit stressful because of the time constraint.","Purpose of the study is to see how we react before and after doing a spatial perception task.","6361b53c44c9c4ebeb619db1",NA,NA,NA,NA,2.667,4.333,4.333,2.333,2.667,1.667,3
"Control",8,24,12,8,"50th percentile",4,3,3,3,3,3,2,2,3,2,NA,NA,NA,NA,NA,NA,NA,NA,NA,NA,NA,NA,NA,NA,NA,NA,NA,NA,3,3,1,2,3,2,3,3,3,3,4,4,1,2,2,2,3,3,2,3,3,3,2,2,2,2,3,2,3,3,3,3,3,2,3,3,3,3,553,"N/A","Test spatial skills in a fast pace environment","610016afc022650a809d6c84",3.2,2.4,NA,NA,2.333,3,3.667,2.667,2.833,2.667,3
"Explicit",8,22,11,8,"50th percentile",NA,NA,NA,NA,NA,NA,NA,NA,NA,NA,NA,NA,NA,NA,NA,NA,5,4,1,4,5,5,5,2,1,1,4,3,5,1,1,5,4,1,5,5,4,5,4,4,1,2,2,5,1,1,5,5,1,3,5,2,2,1,5,3,4,5,2,4,5,1,2,3,4,4,782,"it was confusing and pressuring due to less time","measure spatial ability","657a5fdf40daebdb26cb32b4",NA,NA,4,2.667,2.833,5,4,3,3.833,2.667,3.667
"Implicit",9,25,8,6,"25th percentile",NA,NA,NA,NA,NA,NA,NA,NA,NA,NA,"Tagalog","Tagalog, Spanish",NA,NA,1,1,NA,NA,NA,NA,NA,NA,NA,NA,NA,NA,NA,NA,3,1,1,3,3,1,4,4,4,3,4,4,1,1,1,2,3,3,2,2,2,4,3,3,3,3,5,3,3,3,2,3,5,5,4,5,5,5,747,"I thought the task was fun, but it definitely stressed me out with how quickly I had to answer it.","I think the purpose was to compare one's performance to their feelings/attitudes about themselves and identity","5e574f393e26c90f2b47b96c",NA,NA,NA,NA,2,3.667,4,2.333,3.167,4.667,5
"Explicit",13,19,3,3,"25th percentile",NA,NA,NA,NA,NA,NA,NA,NA,NA,NA,NA,NA,NA,NA,NA,NA,2,3,2,2,4,3,2,2,1,3,3,3,2,1,1,3,3,1,4,3,3,3,4,4,1,2,2,2,2,1,2,3,2,3,3,3,2,2,2,1,1,3,4,2,3,1,5,2,2,2,649,NA,"measure students' perceptions vs reality of their academic ability based on their race and how well they did on the spatial rotation test","65cbac7bda544f05fb8fe69c",NA,NA,2.667,2.333,1.833,3.333,3.667,2,2.167,3,2
"Control",7,21,5,2,"25th percentile",5,5,2,5,2,4,3,4,2,3,NA,NA,NA,NA,NA,NA,NA,NA,NA,NA,NA,NA,NA,NA,NA,NA,NA,NA,4,1,1,4,4,1,4,5,4,4,5,4,2,1,1,2,4,3,1,1,4,3,2,2,1,2,4,4,3,3,5,5,4,2,2,3,3,2,377,NA,"to see whether my ability on the task affected how i felt about my own math skills","62785b6530a3dfd84d8fc34a",3.8,3.2,NA,NA,2.5,4.333,4.333,2.5,4,2.667,2.667
"Implicit",14,25,9,6,"25th percentile",NA,NA,NA,NA,NA,NA,NA,NA,NA,NA,NA,"n/a",NA,NA,1,3,NA,NA,NA,NA,NA,NA,NA,NA,NA,NA,NA,NA,4,2,1,4,3,2,5,5,5,4,4,4,1,2,1,1,3,2,1,1,2,3,4,3,1,2,5,1,2,3,3,2,3,2,2,2,1,2,761,"Had a positive experience overall; was very surprised by my results.","Maybe something along the lines of assessing how perceptions of task performance affect one's attachment to their racial group?","65d57f93dddf2f37836d548a",NA,NA,NA,NA,2.667,4.667,4.333,1.667,2.667,2.333,1.667
"Explicit",8,30,0,1,"25th percentile",NA,NA,NA,NA,NA,NA,NA,NA,NA,NA,NA,NA,NA,NA,NA,NA,4,4,2,5,3,4,1,1,1,1,1,1,3,2,2,3,3,1,3,3,4,2,5,5,1,2,1,3,2,2,3,3,1,2,2,2,1,1,2,1,2,3,2,1,1,1,5,4,2,5,679,"I wasn't sure if the pieces on the spatial rotation test were supposed to be the same as each other or if they were supposed to fit together.","Testing stereotype threat or anxiety in Asian Americans and test performance.","659db524feac2e6da6c43101",NA,NA,3.667,1,2.333,2.667,4.667,2.333,1.833,2.333,3.667
"Control",9,19,13,13,"75th percentile",2,3,2,1,3,2,3,2,3,3,NA,NA,NA,NA,NA,NA,NA,NA,NA,NA,NA,NA,NA,NA,NA,NA,NA,NA,4,2,1,4,3,2,3,4,4,4,4,4,1,1,1,3,1,1,4,3,1,2,4,4,3,3,4,1,2,3,2,1,1,1,4,3,3,3,396,NA,"The purpose of this study was to test spatial abilitiy","65e005d7bad0f1aa8f2ec0f9",2.2,2.6,NA,NA,2.667,3.667,4,2.167,2.167,2,3
"Implicit",10,25,6,10,"75th percentile",NA,NA,NA,NA,NA,NA,NA,NA,NA,NA,"Filipino","n/a",NA,NA,1,1,NA,NA,NA,NA,NA,NA,NA,NA,NA,NA,NA,NA,3,4,1,3,2,1,3,4,4,3,4,3,1,1,1,2,3,2,2,1,2,4,5,4,4,3,4,1,1,4,4,2,3,1,2,3,3,2,555,"I had issues with clicking the matched and unmatched buttons. Only a small portion of the button was clickable, despite prompting me to click on the whole rectangle. The precision needed to click the small dot is too much compared to the speed required by the test. Please fix the button sizes.","Measuring and predicting math ability based on someone's spatial reasoning skills.","5c76616a7fafbd00114723f5",NA,NA,NA,NA,2.333,3.333,3.667,2,2.667,2,2.667
"Explicit",13,21,4,6,"50th percentile",NA,NA,NA,NA,NA,NA,NA,NA,NA,NA,NA,NA,NA,NA,NA,NA,4,3,2,2,1,4,5,2,1,2,2,3,3,2,1,3,3,3,4,4,5,3,4,4,1,2,1,2,2,2,2,3,3,2,3,2,1,2,5,3,4,3,5,4,3,3,2,2,4,4,663,"Definitely felt a little pressure while performing the task","To see how well spatial rotation tasks correspond to mathematical ability","65cb72715efd7cd40fec44df",NA,NA,2.667,2.5,2.5,3.667,4.333,2.333,4,2.667,3.333
"Control",8,23,12,12,"75th percentile",2,3,1,4,3,3,4,2,5,3,NA,NA,NA,NA,NA,NA,NA,NA,NA,NA,NA,NA,NA,NA,NA,NA,NA,NA,5,1,1,5,5,1,5,5,5,5,5,5,1,1,1,5,1,1,5,5,1,2,5,3,3,2,5,5,5,3,2,2,3,4,1,3,4,4,442,NA,"To determine students' ability on math and their relation to it.","659616d78c849893b09541ec",2.6,3.4,NA,NA,3,5,5,3,3.667,2.667,3.667
"Implicit",13,22,10,9,"50th percentile",NA,NA,NA,NA,NA,NA,NA,NA,NA,NA,"Mandarin","Mandarin","Mandarin",NA,1,1,NA,NA,NA,NA,NA,NA,NA,NA,NA,NA,NA,NA,2,3,1,2,2,2,4,3,3,4,4,3,1,1,2,3,2,1,3,2,2,2,4,3,2,2,4,2,2,2,4,2,2,2,4,3,3,3,370,NA,"To test us on how we feel after completing a spatial rotation test and thoughts on our position or how we feel in school.","5fdce42b1976282fd3db47e4",NA,NA,NA,NA,2,3.667,3.333,2.167,2.667,2.667,3
"Explicit",13,21,3,3,"25th percentile",NA,NA,NA,NA,NA,NA,NA,NA,NA,NA,NA,NA,NA,NA,NA,NA,4,5,3,5,4,5,4,3,2,2,4,2,2,4,5,3,3,2,3,3,3,2,3,3,2,2,1,2,4,5,3,2,2,2,3,2,2,2,4,4,3,3,5,4,5,2,4,3,4,4,638,"This was a good experience","See how spatial recognition tasks correlate with math and see how many people agree that it is a good indicator of math skills.","65cb83b3dd72788ad453d725",NA,NA,4.333,2.833,3.167,2.667,3,3,3.833,3.667,3.667
"Implicit",7,21,5,6,"25th percentile",NA,NA,NA,NA,NA,NA,NA,NA,NA,NA,"Tagalog","Tagalog",NA,"50",1,2,NA,NA,NA,NA,NA,NA,NA,NA,NA,NA,NA,NA,4,2,1,4,4,2,4,4,5,4,4,4,1,1,1,3,2,1,3,3,2,3,5,3,2,2,4,2,2,3,2,2,5,2,2,4,4,3,602,"I haven't completed a spatial rotation assessment before so it was certainly an interesting experience. My major doesn't require advanced math (only statistics) and I haven't had a math course in two years, so I expected to score low on a standard math test. I wasn't expecting this type of assessment though. But I didn't have any technical issues while going through the survey. The instructions were easily comprehendable.","To compare our self-perception of our performance as a student based on a sudden ""exam"".","5d5809017d795e001988c0d4",NA,NA,NA,NA,2.833,4,4.333,2.333,2.5,3,3.667
"Explicit",12,31,7,4,"25th percentile",NA,NA,NA,NA,NA,NA,NA,NA,NA,NA,NA,NA,NA,NA,NA,NA,4,4,3,4,3,5,3,3,3,3,2,4,3,1,1,3,3,2,4,4,3,2,2,3,1,1,1,3,2,1,3,3,1,2,5,2,1,1,2,2,1,4,3,2,4,3,3,4,4,5,471,"Straightforward survey","I don't know.","60cf7074e1ea52a0f3450346",NA,NA,3.833,3,2.167,3.333,2.667,2.167,2.333,3.333,4.333
