StartDate,EndDate,Status,Progress,Duration (in seconds),Finished,RecordedDate,ResponseId,DistributionChannel,UserLanguage,Q_RecaptchaScore,Q_RelevantIDDuplicate,Q_RelevantIDDuplicateScore,Q_RelevantIDFraudScore,Q_RelevantIDLastStartDate,Q2,ProlificID,Age,StudentStatus,UndergradYear,MastersYear,DoctoralYear,Control_common_1,Control_common_2,Control_common_3,Control_common_4,Control_common_5,Control_true_1,Control_true_2,Control_true_3,Control_true_4,Control_true_5,Q1,Q1_1_TEXT,Q2,Q3,Q3_1_TEXT,Q4,Q4_1_TEXT,Q5,Q6,Blatant_common_1,Blatant_common_2,Blatant_common_3,Blatant_common_4,Blatant_common_5,Blatant_common_6,Blatant_true_1,Blatant_true_2,Blatant_true_3,Blatant_true_4,Blatant_true_5,Blatant_true_6,STAI_1,STAI_2,STAI_3,STAI_4,STAI_5,STAI_6,Approach2,Approach1,Avoidance3,Approach3,Avoidance2,Avoidance1,1_150,timer_1_150_First Click,timer_1_150_Last Click,timer_1_150_Page Submit,timer_1_150_Click Count,2_150,timer_2_150_First Click,timer_2_150_Last Click,timer_2_150_Page Submit,timer_2_150_Click Count,3_150,timer_3_150_First Click,timer_3_150_Last Click,timer_3_150_Page Submit,timer_3_150_Click Count,4_150,timer_4_150_First Click,timer_4_150_Last Click,timer_4_150_Page Submit,timer_4_150_Click Count,5_150_R,timer_5_150_R_First Click,timer_5_150_R_Last Click,timer_5_150_R_Page Submit,timer_5_150_R_Click Count,pre-expectation,6_150_R,timer_6_150_R_First Click,timer_6_150_R_Last Click,timer_6_150_R_Page Submit,timer_6_150_R_Click Count,7_150_R,timer_7_150_R_First Click,timer_7_150_R_Last Click,timer_7_150_R_Page Submit,timer_7_150_R_Click Count,8_150_R,timer_8_150_R_First Click,timer_8_150_R_Last Click,timer_8_150_R_Page Submit,timer_8_150_R_Click Count,9_150,timer_9_150_First Click,timer_9_150_Last Click,timer_9_150_Page Submit,timer_9_150_Click Count,10_150_R,timer_10_150_R_First Click,timer_10_150_R_Last Click,timer_10_150_R_Page Submit,timer_10_150_R_Click Count,11_150,timer_11_150_First Click,timer_11_150_Last Click,timer_11_150_Page Submit,timer_11_150_Click Count,12_150,timer_12_150_First Click,timer_12_150_Last Click,timer_12_150_Page Submit,timer_12_150_Click Count,13_150,timer_13_150_First Click,timer_13_150_Last Click,timer_13_150_Page Submit,timer_13_150_Click Count,14_150_R,timer_14_150_R_First Click,timer_14_150_R_Last Click,timer_14_150_R_Page Submit,timer_14_150_R_Click Count,15_150,timer_15_150_First Click,timer_15_150_Last Click,timer_15_150_Page Submit,timer_15_150_Click Count,16_150_R,timer_16_150_R_First Click,timer_16_150_R_Last Click,timer_16_150_R_Page Submit,timer_16_150_R_Click Count,17_150_R,timer_17_150_R_First Click,timer_17_150_R_Last Click,timer_17_150_R_Page Submit,timer_17_150_R_Click Count,18_150_R,timer_18_150_R_First Click,timer_18_150_R_Last Click,timer_18_150_R_Page Submit,timer_18_150_R_Click Count,19_150,timer_19_150_First Click,timer_19_150_Last Click,timer_19_150_Page Submit,timer_19_150_Click Count,20_150_R,timer_20_150_R_First Click,timer_20_150_R_Last Click,timer_20_150_R_Page Submit,timer_20_150_R_Click Count,mc_task,mc_mathability,mc_diagnostic,STAI_1,STAI_2,STAI_3,STAI_4,STAI_5,STAI_6,task_stressful,post-expectation,Pressure,Comparison,task_opinion,Math_abilities1,Math_abilities2,RIT1,RIT2,RIT3,RIT4,RIT5,RIT6,B1,B2,B3_Reverse,Centrality1,Centrality2,Centrality3,Feedback,Purpose,debrief_include_data,debrief_timer_First Click,debrief_timer_Last Click,debrief_timer_Page Submit,debrief_timer_Click Count,SC0,SC1,PROLIFIC_PID,Bonus,STUDY_ID,SESSION_ID
Start Date,End Date,Response Type,Progress,Duration (in seconds),Finished,Recorded Date,Response ID,Distribution Channel,User Language,Q_RecaptchaScore,Q_RelevantIDDuplicate,Q_RelevantIDDuplicateScore,Q_RelevantIDFraudScore,Q_RelevantIDLastStartDate,"Let's make sure those instructions about bonus payments were clear.
You will receive a bonus payment of $[Field-bonus] if you do which of the following?",The box below should autofill with your Prolific ID. Please verify that it is correct or enter your correct Prolific ID before continuing with the study.,What is your age? (in years),What is your current student status?,What is your current year in school?,What is your current year in school?,What is your current year in school?,"In your opinion, how common are the following stereotypes: - young adults are carefree","In your opinion, how common are the following stereotypes: - young adults are rowdy","In your opinion, how common are the following stereotypes: - young adults are optimistic","In your opinion, how common are the following stereotypes: - young adults are lonely","In your opinion, how common are the following stereotypes: - young adults are energetic","In your opinion, how true are the following stereotypes: - young adults are carefree","In your opinion, how true are the following stereotypes: - young adults are rowdy","In your opinion, how true are the following stereotypes: - young adults are optimistic","In your opinion, how true are the following stereotypes: - young adults are lonely","In your opinion, how true are the following stereotypes: - young adults are energetic","Do your parents or grandparents speak any languages other than English? If so, please indicate what language(s). - Selected Choice","Do your parents or grandparents speak any languages other than English? If so, please indicate what language(s). - Yes - Text",What languages (besides English) do you know?,"Do you speak any languages (besides English) at home? If so, please indicate what language(s). - Selected Choice","Do you speak any languages (besides English) at home? If so, please indicate what language(s). - Yes - Text","Do you have opportunities to speak other languages on campus? If yes, what percentage of these opportunities were found in your residence halls? (e,g., 50 = 50%) - Selected Choice","Do you have opportunities to speak other languages on campus? If yes, what percentage of these opportunities were found in your residence halls? (e,g., 50 = 50%) - Yes - Text",Are you involved with any student organizations?,How many generations of your family have lived in America?,"In your opinion, how common are the following stereotypes about Asian Americans: - Asian Americans are respectful","In your opinion, how common are the following stereotypes about Asian Americans: - Asian Americans are quiet","In your opinion, how common are the following stereotypes about Asian Americans: - Asian Americans have poor verbal skills","In your opinion, how common are the following stereotypes about Asian Americans: - Asian Americans are stingy","In your opinion, how common are the following stereotypes about Asian Americans: - Asian Americans are modest","In your opinion, how common are the following stereotypes about Asian Americans: - Asian Americans are good at mathematics","In your opinion, how true are the following stereotypes about Asian Americans: - Asian Americans are respectful","In your opinion, how true are the following stereotypes about Asian Americans: - Asian Americans are quiet","In your opinion, how true are the following stereotypes about Asian Americans: - Asian Americans have poor verbal skills","In your opinion, how true are the following stereotypes about Asian Americans: - Asian Americans are stingy","In your opinion, how true are the following stereotypes about Asian Americans: - Asian Americans are modest","In your opinion, how true are the following stereotypes about Asian Americans: - Asian Americans are good at mathematics",I feel calm.,I am tense.,I feel upset.,I am relaxed.,I feel content.,I am worried.,I am striving to do well compared to other students.,My aim is to perform well relative to other students.,My goal is to avoid performing poorly compared to others.,My goal is to perform better than the other students.,I am striving to avoid performing worse than others.,My aim is to avoid doing worse than other students.,1_150,Timing - First Click,Timing - Last Click,Timing - Page Submit,Timing - Click Count,2_150,Timing - First Click,Timing - Last Click,Timing - Page Submit,Timing - Click Count,3_150,Timing - First Click,Timing - Last Click,Timing - Page Submit,Timing - Click Count,4_150,Timing - First Click,Timing - Last Click,Timing - Page Submit,Timing - Click Count,5_150_R,Timing - First Click,Timing - Last Click,Timing - Page Submit,Timing - Click Count,Before you begin the task: how many points do you think you will get (out of 15)?,6_150_R,Timing - First Click,Timing - Last Click,Timing - Page Submit,Timing - Click Count,7_150_R,Timing - First Click,Timing - Last Click,Timing - Page Submit,Timing - Click Count,8_150_R,Timing - First Click,Timing - Last Click,Timing - Page Submit,Timing - Click Count,9_150,Timing - First Click,Timing - Last Click,Timing - Page Submit,Timing - Click Count,10_150_R,Timing - First Click,Timing - Last Click,Timing - Page Submit,Timing - Click Count,11_150,Timing - First Click,Timing - Last Click,Timing - Page Submit,Timing - Click Count,12_150,Timing - First Click,Timing - Last Click,Timing - Page Submit,Timing - Click Count,13_150,Timing - First Click,Timing - Last Click,Timing - Page Submit,Timing - Click Count,14_150_R,Timing - First Click,Timing - Last Click,Timing - Page Submit,Timing - Click Count,15_150,Timing - First Click,Timing - Last Click,Timing - Page Submit,Timing - Click Count,16_150_R,Timing - First Click,Timing - Last Click,Timing - Page Submit,Timing - Click Count,17_150_R,Timing - First Click,Timing - Last Click,Timing - Page Submit,Timing - Click Count,18_150_R,Timing - First Click,Timing - Last Click,Timing - Page Submit,Timing - Click Count,19_150,Timing - First Click,Timing - Last Click,Timing - Page Submit,Timing - Click Count,20_150_R,Timing - First Click,Timing - Last Click,Timing - Page Submit,Timing - Click Count,What kind of task did you just complete?,Were you told this task was diagnostic of your math ability?,Were you told this task was predictive of performance in math?,I feel calm.,I am tense.,I feel upset.,I am relaxed.,I feel content.,I am worried.,How stressful did you find this task?,How many points did you think you got out of 15?,Rate your agreement with the following statement: I performed as well as I could on the task.,Please indicate the quantile range within which you anticipate your performance on this task will fall compared to other participants in the study.,To what extent do YOU think spatial reasoning ability is predictive of math performance?,I viewed this task as a good way to showcase my math abilities.,I viewed this task as a way to measure my true math abilities.,I worry that people at my school will think I'm dumb if I do badly as a student.,I worry that people at my school will judge my racial group based on the behavior or performance of other people my race.,I worry that people at my school will judge my racial group based on my own behavior or performance.,I am confident that others at my school have a good impression of my ability.,Other people at my school may use my race when judging my behavior.,I worry that people at my school will judge me based on what they think of my race.,"Sometimes I feel that I belong at my university, and sometimes I feel that I don’t belong.","When something bad happens, I feel that maybe I don’t belong at my university.","When something good happens, I feel that I really belong at my university.",I have a strong attachment to other people of my race.,The racial group I belong to is an important reflection of who I am.,"In general, belonging to my racial group is an
important part of my self image.",We would like to know about your experience with this survey and any feedback you would like to share in the space below.,What do think the purpose of this study is?,"Given this, if you would now like your data to be excluded from analysis, you have that option. Your choice will in no way effect your compensation for participation or your ability to complete future research studies.



Please make your selection:",Timing - First Click,Timing - Last Click,Timing - Page Submit,Timing - Click Count,Practice,Score,PROLIFIC_PID,Bonus,STUDY_ID,SESSION_ID
"{""ImportId"":""startDate"",""timeZone"":""America/New_York""}","{""ImportId"":""endDate"",""timeZone"":""America/New_York""}","{""ImportId"":""status""}","{""ImportId"":""progress""}","{""ImportId"":""duration""}","{""ImportId"":""finished""}","{""ImportId"":""recordedDate"",""timeZone"":""America/New_York""}","{""ImportId"":""_recordId""}","{""ImportId"":""distributionChannel""}","{""ImportId"":""userLanguage""}","{""ImportId"":""Q_RecaptchaScore""}","{""ImportId"":""Q_RelevantIDDuplicate""}","{""ImportId"":""Q_RelevantIDDuplicateScore""}","{""ImportId"":""Q_RelevantIDFraudScore""}","{""ImportId"":""Q_RelevantIDLastStartDate"",""timeZone"":""UTC""}","{""ImportId"":""QID1716757326""}","{""ImportId"":""QID730_TEXT""}","{""ImportId"":""QID7_TEXT""}","{""ImportId"":""QID9""}","{""ImportId"":""QID10""}","{""ImportId"":""QID11""}","{""ImportId"":""QID12""}","{""ImportId"":""QID522_4""}","{""ImportId"":""QID522_5""}","{""ImportId"":""QID522_6""}","{""ImportId"":""QID522_7""}","{""ImportId"":""QID522_8""}","{""ImportId"":""QID409_4""}","{""ImportId"":""QID409_5""}","{""ImportId"":""QID409_6""}","{""ImportId"":""QID409_7""}","{""ImportId"":""QID409_8""}","{""ImportId"":""QID423""}","{""ImportId"":""QID423_1_TEXT""}","{""ImportId"":""QID524_TEXT""}","{""ImportId"":""QID525""}","{""ImportId"":""QID525_1_TEXT""}","{""ImportId"":""QID526""}","{""ImportId"":""QID526_1_TEXT""}","{""ImportId"":""QID529""}","{""ImportId"":""QID527""}","{""ImportId"":""QID410_4""}","{""ImportId"":""QID410_5""}","{""ImportId"":""QID410_6""}","{""ImportId"":""QID410_7""}","{""ImportId"":""QID410_8""}","{""ImportId"":""QID410_9""}","{""ImportId"":""QID523_4""}","{""ImportId"":""QID523_5""}","{""ImportId"":""QID523_6""}","{""ImportId"":""QID523_7""}","{""ImportId"":""QID523_8""}","{""ImportId"":""QID523_9""}","{""ImportId"":""QID579""}","{""ImportId"":""QID580""}","{""ImportId"":""QID581""}","{""ImportId"":""QID582""}","{""ImportId"":""QID583""}","{""ImportId"":""QID584""}","{""ImportId"":""QID688""}","{""ImportId"":""QID690""}","{""ImportId"":""QID692""}","{""ImportId"":""QID694""}","{""ImportId"":""QID696""}","{""ImportId"":""QID698""}","{""ImportId"":""QID321""}","{""ImportId"":""QID324_FIRST_CLICK""}","{""ImportId"":""QID324_LAST_CLICK""}","{""ImportId"":""QID324_PAGE_SUBMIT""}","{""ImportId"":""QID324_CLICK_COUNT""}","{""ImportId"":""QID326""}","{""ImportId"":""QID336_FIRST_CLICK""}","{""ImportId"":""QID336_LAST_CLICK""}","{""ImportId"":""QID336_PAGE_SUBMIT""}","{""ImportId"":""QID336_CLICK_COUNT""}","{""ImportId"":""QID328""}","{""ImportId"":""QID338_FIRST_CLICK""}","{""ImportId"":""QID338_LAST_CLICK""}","{""ImportId"":""QID338_PAGE_SUBMIT""}","{""ImportId"":""QID338_CLICK_COUNT""}","{""ImportId"":""QID330""}","{""ImportId"":""QID340_FIRST_CLICK""}","{""ImportId"":""QID340_LAST_CLICK""}","{""ImportId"":""QID340_PAGE_SUBMIT""}","{""ImportId"":""QID340_CLICK_COUNT""}","{""ImportId"":""QID334""}","{""ImportId"":""QID325_FIRST_CLICK""}","{""ImportId"":""QID325_LAST_CLICK""}","{""ImportId"":""QID325_PAGE_SUBMIT""}","{""ImportId"":""QID325_CLICK_COUNT""}","{""ImportId"":""QID507_TEXT""}","{""ImportId"":""QID346""}","{""ImportId"":""QID347_FIRST_CLICK""}","{""ImportId"":""QID347_LAST_CLICK""}","{""ImportId"":""QID347_PAGE_SUBMIT""}","{""ImportId"":""QID347_CLICK_COUNT""}","{""ImportId"":""QID350""}","{""ImportId"":""QID351_FIRST_CLICK""}","{""ImportId"":""QID351_LAST_CLICK""}","{""ImportId"":""QID351_PAGE_SUBMIT""}","{""ImportId"":""QID351_CLICK_COUNT""}","{""ImportId"":""QID354""}","{""ImportId"":""QID355_FIRST_CLICK""}","{""ImportId"":""QID355_LAST_CLICK""}","{""ImportId"":""QID355_PAGE_SUBMIT""}","{""ImportId"":""QID355_CLICK_COUNT""}","{""ImportId"":""QID358""}","{""ImportId"":""QID359_FIRST_CLICK""}","{""ImportId"":""QID359_LAST_CLICK""}","{""ImportId"":""QID359_PAGE_SUBMIT""}","{""ImportId"":""QID359_CLICK_COUNT""}","{""ImportId"":""QID363""}","{""ImportId"":""QID365_FIRST_CLICK""}","{""ImportId"":""QID365_LAST_CLICK""}","{""ImportId"":""QID365_PAGE_SUBMIT""}","{""ImportId"":""QID365_CLICK_COUNT""}","{""ImportId"":""QID366""}","{""ImportId"":""QID368_FIRST_CLICK""}","{""ImportId"":""QID368_LAST_CLICK""}","{""ImportId"":""QID368_PAGE_SUBMIT""}","{""ImportId"":""QID368_CLICK_COUNT""}","{""ImportId"":""QID370""}","{""ImportId"":""QID371_FIRST_CLICK""}","{""ImportId"":""QID371_LAST_CLICK""}","{""ImportId"":""QID371_PAGE_SUBMIT""}","{""ImportId"":""QID371_CLICK_COUNT""}","{""ImportId"":""QID374""}","{""ImportId"":""QID375_FIRST_CLICK""}","{""ImportId"":""QID375_LAST_CLICK""}","{""ImportId"":""QID375_PAGE_SUBMIT""}","{""ImportId"":""QID375_CLICK_COUNT""}","{""ImportId"":""QID380""}","{""ImportId"":""QID381_FIRST_CLICK""}","{""ImportId"":""QID381_LAST_CLICK""}","{""ImportId"":""QID381_PAGE_SUBMIT""}","{""ImportId"":""QID381_CLICK_COUNT""}","{""ImportId"":""QID382""}","{""ImportId"":""QID383_FIRST_CLICK""}","{""ImportId"":""QID383_LAST_CLICK""}","{""ImportId"":""QID383_PAGE_SUBMIT""}","{""ImportId"":""QID383_CLICK_COUNT""}","{""ImportId"":""QID388""}","{""ImportId"":""QID389_FIRST_CLICK""}","{""ImportId"":""QID389_LAST_CLICK""}","{""ImportId"":""QID389_PAGE_SUBMIT""}","{""ImportId"":""QID389_CLICK_COUNT""}","{""ImportId"":""QID392""}","{""ImportId"":""QID393_FIRST_CLICK""}","{""ImportId"":""QID393_LAST_CLICK""}","{""ImportId"":""QID393_PAGE_SUBMIT""}","{""ImportId"":""QID393_CLICK_COUNT""}","{""ImportId"":""QID396""}","{""ImportId"":""QID397_FIRST_CLICK""}","{""ImportId"":""QID397_LAST_CLICK""}","{""ImportId"":""QID397_PAGE_SUBMIT""}","{""ImportId"":""QID397_CLICK_COUNT""}","{""ImportId"":""QID398""}","{""ImportId"":""QID399_FIRST_CLICK""}","{""ImportId"":""QID399_LAST_CLICK""}","{""ImportId"":""QID399_PAGE_SUBMIT""}","{""ImportId"":""QID399_CLICK_COUNT""}","{""ImportId"":""QID404""}","{""ImportId"":""QID405_FIRST_CLICK""}","{""ImportId"":""QID405_LAST_CLICK""}","{""ImportId"":""QID405_PAGE_SUBMIT""}","{""ImportId"":""QID405_CLICK_COUNT""}","{""ImportId"":""QID569""}","{""ImportId"":""QID308""}","{""ImportId"":""QID530""}","{""ImportId"":""QID724""}","{""ImportId"":""QID725""}","{""ImportId"":""QID726""}","{""ImportId"":""QID727""}","{""ImportId"":""QID728""}","{""ImportId"":""QID729""}","{""ImportId"":""QID245""}","{""ImportId"":""QID534_TEXT""}","{""ImportId"":""QID515""}","{""ImportId"":""QID535""}","{""ImportId"":""QID244""}","{""ImportId"":""QID517""}","{""ImportId"":""QID537""}","{""ImportId"":""QID539""}","{""ImportId"":""QID540""}","{""ImportId"":""QID541""}","{""ImportId"":""QID543""}","{""ImportId"":""QID544""}","{""ImportId"":""QID545""}","{""ImportId"":""QID555""}","{""ImportId"":""QID556""}","{""ImportId"":""QID557""}","{""ImportId"":""QID559""}","{""ImportId"":""QID560""}","{""ImportId"":""QID561""}","{""ImportId"":""QID520_TEXT""}","{""ImportId"":""QID521_TEXT""}","{""ImportId"":""QID621""}","{""ImportId"":""QID623_FIRST_CLICK""}","{""ImportId"":""QID623_LAST_CLICK""}","{""ImportId"":""QID623_PAGE_SUBMIT""}","{""ImportId"":""QID623_CLICK_COUNT""}","{""ImportId"":""SC_eVVoqVsoHqYEZyC""}","{""ImportId"":""SC_5bQkREfnGkt583k""}","{""ImportId"":""PROLIFIC_PID""}","{""ImportId"":""Bonus""}","{""ImportId"":""STUDY_ID""}","{""ImportId"":""SESSION_ID""}"
2024-03-17 09:41:35,2024-03-17 09:49:38,0,100,483,1,2024-03-17 09:49:39,R_5K12j5R1gAUfRak,anonymous,EN,0.8999999761581421,,0,0,,3,60fd97382c97fa063217683b,29,3,,,1,,,,,,,,,,,,,,,,,,,,4,4,2,4,4,5,4,3,1,3,3,4,3,2,2,3,2,3,3,2,3,2,4,3,1,4.931,4.931,4.94,1,2,4.434,4.434,4.44,1,1,5.138,5.138,5.146,1,2,5.026,5.026,5.032,1,1,6.403,6.403,6.409,1,5,2,5.706,5.706,5.714,1,2,6.188,6.188,6.198,1,1,6.825,6.825,6.833,1,1,5.963,5.963,5.969,1,,0,0,7.514,0,2,4.622,4.622,4.629,1,1,5.727,5.727,5.733,1,1,5.457,5.457,5.463,1,2,5.842,5.842,5.849,1,1,5.717,5.717,5.724,1,1,5.249,5.249,5.255,1,2,7.159,7.159,7.166,1,2,5.634,5.634,5.64,1,1,5.558,5.558,5.565,1,1,5.234,5.234,5.24,1,1,1,2,2,3,2,2,2,3,3,3,4,2,1,2,1,4,4,3,3,2,3,4,3,3,3,3,3,,To investigate how thinking about racial stereotypes affects performance on a task that a participant is told will relate to those stereotypes.,1,44.929,44.929,48.093,1,2,10,60fd97382c97fa063217683b,1.00,65eb71d2057019b2bf7e18f7,65f6f30884a132e10ed60303
2024-03-17 09:42:56,2024-03-17 09:51:41,0,100,525,1,2024-03-17 09:51:42,R_2ANzTmA7r0VbQFm,anonymous,EN,1,,0,0,,3,5c395df5f5ebd50001850900,28,1,4,,,4,5,4,2,2,2,3,3,2,2,,,,,,,,,,,,,,,,,,,,,,5,1,1,5,5,1,2,1,1,2,1,1,2,5.785,5.785,5.789,1,1,4.971,4.971,4.974,1,1,5.454,5.454,5.456,1,1,4.568,4.568,4.571,1,1,5.541,5.541,5.544,1,8,1,4.129,4.129,4.132,1,2,5.099,5.099,5.102,1,1,4.816,4.816,4.82,1,1,5.455,5.455,5.458,1,2,5.127,5.127,5.131,1,1,4.295,4.295,4.298,1,1,5.055,5.055,5.058,1,1,5.006,5.006,5.009,1,1,4.057,4.057,4.06,1,1,4.718,4.718,4.721,1,2,6.107,6.107,6.11,1,2,6.415,6.415,6.418,1,1,6.008,6.008,6.011,1,1,4.538,4.538,4.541,1,2,5.265,5.265,5.268,1,1,1,1,5,1,1,5,5,1,1,8,3,3,1,1,1,2,4,1,1,5,3,4,1,4,1,3,3,"I think that the pay is a fair rate for the work involved, and the bonus is nice too.",How people react to math problems,1,7.136,31.58,31.993,4,3,11,5c395df5f5ebd50001850900,1.00,65eb71d2057019b2bf7e18f7,65f6f3572095aeb852e83015
2024-03-17 10:02:09,2024-03-17 10:17:59,0,100,950,1,2024-03-17 10:18:00,R_12ZKQnluuF3rOBb,anonymous,EN,1,,0,0,,3,5f18610a63c761000bf6a39a,26,2,,2,,4,5,2,4,3,3,2,3,3,3,,,,,,,,,,,,,,,,,,,,,,2,5,3,2,2,5,4,3,4,2,4,4,1,6.378,6.378,6.386,1,2,4.32,4.32,4.323,1,,0,0,7.512,0,1,5.792,5.792,5.796,1,1,5.29,5.29,5.294,1,6,1,4.437,4.437,4.443,1,1,5.541,5.541,5.544,1,,0,0,7.508,0,2,5.13,5.13,5.134,1,2,5.154,5.154,5.161,1,2,4.423,4.423,4.427,1,1,6.144,6.144,6.147,1,1,5.348,5.348,5.351,1,2,5.806,5.806,5.809,1,2,4.607,4.607,4.612,1,1,4.13,4.13,4.135,1,2,4.197,4.197,4.2,1,1,4.612,4.612,4.616,1,1,4.424,4.424,4.431,1,2,4.927,5.505,5.509,2,1,1,1,2,4,3,2,2,5,4,5,2,2,1,1,1,5,2,2,4,3,3,2,1,2,4,4,4,,To understand how participants see their intelligence both individually and as part of their racial group.,1,10.389,10.389,41.849,1,2,7,5f18610a63c761000bf6a39a,1.00,65eb71d2057019b2bf7e18f7,65f6f7d860d4d42d214cf7d9
2024-03-17 09:51:22,2024-03-17 10:32:08,0,100,2445,1,2024-03-17 10:32:08,R_1VKowjHKMmuyHOx,anonymous,EN,1,,0,10,,3,5f74fd83ed11b81620baf105,32,1,4,,,,,,,,,,,,,,,,,,,,,,4,5,2,5,4,5,4,2,1,5,3,3,1,5,4,1,2,5,5,5,5,4,5,5,,6.098,6.14,7.519,2,2,5.868,5.868,5.882,1,1,5.561,5.561,5.571,1,1,5.59,5.59,5.598,1,2,4.417,4.417,4.422,1,5,2,6.443,6.443,6.451,1,2,5.869,5.869,5.878,1,2,6.647,6.647,6.654,1,1,6.834,6.834,6.842,1,1,6.209,6.209,6.215,1,,0,0,7.644,0,1,5.159,5.159,5.17,1,1,6.398,6.398,6.301,1,2,4.889,4.889,4.894,1,1,4.611,4.611,4.623,1,2,4.195,4.195,4.208,1,1,6.018,6.018,6.024,1,2,5.217,5.217,5.225,1,1,5.184,5.184,5.196,1,1,5.589,5.589,5.599,1,1,1,1,2,5,4,1,1,5,4,5,4,2,2,1,2,5,2,3,2,4,4,3,2,2,4,5,5,The overall experience was positive.,Why we think and behave in the way that we do.,1,2.829,2.829,34.572,1,3,11,5f74fd83ed11b81620baf105,1.00,65eb71d2057019b2bf7e18f7,65f6f55178b358ac91090e5f
2024-03-17 10:29:56,2024-03-17 10:36:39,0,100,402,1,2024-03-17 10:36:39,R_3CrUD4tKDncmFzB,anonymous,EN,1,,0,0,,3,65cb7423c2fd2bb43b0aa84e,18,1,1,,,,,,,,,,,,,,,,,,,,,,2,3,4,4,3,5,3,3,2,3,3,4,4,1,1,3,3,1,4,4,5,4,5,5,,0,0,7.508,0,1,1.191,5.438,5.447,2,2,5.412,5.412,5.418,1,2,4.794,4.794,4.799,1,2,3.44,3.44,3.445,1,7,2,4.122,4.122,4.129,1,1,3.973,3.973,3.979,1,1,4.137,4.137,4.144,1,1,3.687,3.687,3.694,1,2,4.058,4.058,4.065,1,1,4.322,4.322,4.327,1,1,3.751,3.751,3.757,1,2,4.193,4.193,4.2,1,1,4.057,4.057,4.063,1,2,3.987,3.987,3.994,1,1,4.007,4.007,4.014,1,2,4.581,4.581,4.587,1,1,4.038,4.038,4.043,1,1,4.286,4.286,4.293,1,1,3.441,3.441,3.448,1,1,2,2,2,2,1,2,3,1,3,5,3,3,2,2,2,3,4,4,3,4,4,2,3,1,5,5,5,,to see how people think about their own skills after doing the activity.,1,11.586,11.586,38.006,1,2,7,65cb7423c2fd2bb43b0aa84e,1.00,65eb71d2057019b2bf7e18f7,65f6fe58ac6d07365c1633db
2024-03-17 10:23:15,2024-03-17 10:39:11,0,100,956,1,2024-03-17 10:39:12,R_2ztNfLt7zcVCN64,anonymous,EN,1,,0,0,,3,6560ca7bb947c4f10cf53c36,23,2,,1,,,,,,,,,,,,1,Gujarati,Spanish,2,,2,,2,1,,,,,,,,,,,,,4,1,1,3,3,1,3,3,3,3,3,3,,4.44,5.578,7.627,3,2,5.78,5.78,5.796,1,2,7.041,7.041,7.057,1,1,6.138,6.138,6.152,1,2,6.146,6.146,6.16,1,9,2,5.697,5.697,5.601,1,2,5.252,5.252,5.263,1,2,4.612,4.612,4.622,1,1,4.989,4.989,5,1,2,4.685,4.685,4.698,1,2,6.571,6.571,6.583,1,1,5.796,5.796,5.702,1,1,5.517,5.517,5.526,1,2,5.346,5.346,5.356,1,1,4.373,4.373,4.385,1,2,5.041,5.041,5.05,1,1,6.905,6.905,6.912,1,2,4.759,4.759,4.773,1,1,4.402,4.402,4.413,1,2,4.816,4.816,4.825,1,1,1,1,3,2,1,3,3,1,3,10,4,3,3,3,3,3,2,2,4,2,2,2,2,2,3,3,3,,measure how stressed people get,1,4.624,4.624,32.56,1,2,13,6560ca7bb947c4f10cf53c36,1.00,65eb71d2057019b2bf7e18f7,65f6fcc0c4b0110a2eeab296
2024-03-17 10:29:48,2024-03-17 10:40:04,0,100,616,1,2024-03-17 10:40:05,R_1opXYEKFN7FK5BN,anonymous,EN,1,,0,0,,3,65cbbd44c0db5f5e848d0b20,25,2,,1,,2,3,3,4,4,2,3,3,4,3,,,,,,,,,,,,,,,,,,,,,,3,3,2,2,3,3,3,3,3,3,3,3,1,6.759,6.759,6.771,1,,7.051,7.051,7.51,1,1,4.989,4.989,5.002,1,1,5.745,5.745,5.757,1,2,5.707,5.707,5.718,1,10,2,5.93,5.93,5.941,1,1,5.537,5.537,5.547,1,2,5.816,5.816,5.827,1,1,5.804,5.804,5.817,1,2,6.725,6.725,6.735,1,1,5.757,5.757,5.766,1,1,5.095,5.095,5.001,1,1,7.097,7.097,7.001,1,,0,0,7.51,0,2,0,0,0,0,1,4.327,4.327,4.337,1,2,4.444,4.444,4.455,1,2,5.07,5.07,5.077,1,1,4.011,4.011,4.021,1,1,4.491,4.491,4.4,1,1,2,2,3,3,2,3,3,3,3,10,4,3,2,1,2,3,2,2,4,3,1,2,1,4,4,4,4,"My only comment to add is that during the spatial testing, the red light indication when moving onto the next question made me mildly panic because I thought I got the answers wrong",To compare the scores between students in different learning levels,1,25.238,25.238,33.5,1,4,10,65cbbd44c0db5f5e848d0b20,1.00,65eb71d2057019b2bf7e18f7,65f6fe504a240ca7a04c06b6
